{
  "spec_version": "0.4.0",
  "policy_id": "sia:policy:core-context:1",
  "policy_version": "0.4.0",
  "axis_requirements": {
    "motion_state": {
      "max_age_ms": 100,
      "min_confidence": 95,
      "unknown_handling": "safe_worst_case"
    },
    "operating_mode": {
      "max_age_ms": 500,
      "min_confidence": 90,
      "unknown_handling": "safe_worst_case"
    },
    "energy_state": {
      "max_age_ms": 1000,
      "min_confidence": 90,
      "unknown_handling": "safe_worst_case"
    },
    "road_type": {
      "max_age_ms": 300000,
      "min_confidence": 50,
      "unknown_handling": "safe_worst_case"
    },
    "driver_state": {
      "max_age_ms": 250,
      "min_confidence": 70,
      "unknown_handling": "safe_worst_case"
    },
    "occupancy": {
      "max_age_ms": 1000,
      "min_confidence": 80,
      "unknown_handling": "fail_closed"
    }
  },
  "attention_modifiers": {
    "road_type": {
      "urban": 1,
      "rural": 0.9,
      "highway": 1.2,
      "off_road": 1.3,
      "unknown": 1.3
    },
    "driver_state": {
      "attentive": 1,
      "drowsy": 1.3,
      "distracted": 1.5,
      "not_monitoring": 1.5,
      "unknown": 1.5
    }
  },
  "integrity": {
    "issuer": "SIA Test Policy Authority",
    "key_id": "vehicle-hsm:policy:1",
    "algorithm": "EdDSA",
    "signature": "YM2UNreco4-9TUcnDPc60KoXTJ_Y9bSWg0TKEtOVC6mcuR5Xtng_b22EAfVte1HgebKCSWevW8BemOp-w7FRBA"
  }
}
